{
  "schema_version": 1,
  "request_id": "N-0712E4C8DAE168B7FF9DEAF6C58EDF28",
  "seq": 2,
  "event_id": "259dab16-82ef-4db8-a3a8-5f3bb9437081",
  "actor_id": "xuym",
  "occurred_at": "2026-10-29T04:51:12.642Z",
  "idempotency_key": "inbox-resolve:N-0712E4C8DAE168B7FF9DEAF6C58EDF28:1",
  "type": "answered",
  "response": "你好，我是 xuym 项目协作机器人。你可以 @我描述开发需求、问题和预期效果；我会澄清需求、按项目流程修改代码、运行检查并提交阶段结果供你审核，也可以回答项目和任务状态问题。当前已接入前端、后端两类工作。审核、任务完成和合并会遵循团队规定的人工作业流程。",
  "team_hash": "348b58c3ab32d0c7887b9033e380fc1bdd5e4562b18c6c29930ccf906c6f0018",
  "signature": "HjI9cSVvXpV1/MKpHeBrwL46BdCtwmr54AhqUaXz+M/1EGeodVCqL2ogNjo9GJqcrRAmc+E5hXTR3dLqD61oCA=="
}
