{
  "schema_version": 1,
  "request_id": "N-24EE6EC7EB11CA5348E6937E5AF5646B",
  "seq": 1,
  "event_id": "974012d8-8e06-4c7c-a197-33e14965ee6a",
  "actor_id": "xuym",
  "occurred_at": "2026-10-25T14:28:07.033Z",
  "idempotency_key": "inbox-message:xuym:97998e9e6cc3a7dc2adfa72ce43f36fc05592011cbec39074171a613231ca610",
  "type": "received",
  "spec_hash": "2a94f0bfc6024eb9e0ec578815569a5804136894deb3333573c273f6e7609a69",
  "team_hash": "348b58c3ab32d0c7887b9033e380fc1bdd5e4562b18c6c29930ccf906c6f0018",
  "signature": "Jf+OpSv/QfVE0TaZAiAR0hGso1slMeF8S2fMweTN7qgr0e3ciEOOraRcLCJhh/Lhmcnk5nd7xW9th6YBFylKAg=="
}
