{
  "schema_version": 1,
  "request_id": "N-24EE6EC7EB11CA5348E6937E5AF5646B",
  "seq": 2,
  "event_id": "88d73bea-2476-449c-b3c9-63b385d279c3",
  "actor_id": "xuym",
  "occurred_at": "2026-10-25T14:28:59.028Z",
  "idempotency_key": "inbox-resolve:N-24EE6EC7EB11CA5348E6937E5AF5646B:1",
  "type": "answered",
  "response": "可以，xuym 已绑定当前 Codex 对话，团队协作心跳已启用，可以接收并处理前端、后端任务。目前团队只配置了 xuym 一名机器人，暂不能分派给其他机器人。请直接描述任务目标、范围和验收要求，我会据此处理。",
  "team_hash": "348b58c3ab32d0c7887b9033e380fc1bdd5e4562b18c6c29930ccf906c6f0018",
  "signature": "bCcDaKGO62s6SxisHDjTVeCDEtkwp3kK4y4Va1fBQ8rs9o4hsgFFzZITiniemxsd9WCuY+W9lSdxPn7/tAnLAQ=="
}
